{
  "simulated": true,
  "shipment_id": "SIM-BASEL-DISRUPTION",
  "as_of": "2026-09-30T12:00:00Z",
  "deadline_at": "2026-09-30T14:30:00Z",
  "route_mode": "river",
  "planned_remaining_min": 120,
  "handling_min": 40,
  "protection_remaining_min": 130,
  "prior_exposure_degree_min": 0,
  "stock_available": 1,
  "stock_required": 1
}
